{
  "schema_version": "1.0",
  "project": {
    "id": "cdx-manager",
    "display_name": "CDX Manager",
    "release_profile": "node-cli"
  },
  "version_sources": [
    {
      "path": "package.json",
      "format": "json",
      "selector": "version",
      "required": true
    }
  ],
  "changelog": {
    "required": true,
    "version_heading_required": true,
    "paths": [
      {
        "path": "CHANGELOG.md",
        "format": "markdown",
        "required": true
      }
    ]
  },
  "state_machine": [
    "planning",
    "preparing",
    "local_validation",
    "commit_ready",
    "pushed",
    "ci_verification",
    "github_release",
    "external_publication",
    "ready",
    "blocked"
  ],
  "gates": [
    {
      "id": "version_metadata",
      "state": "preparing",
      "required": true,
      "evidence_kinds": [
        "file"
      ],
      "comparison": "release"
    },
    {
      "id": "changelog",
      "state": "preparing",
      "required": true,
      "evidence_kinds": [
        "file"
      ],
      "comparison": "release"
    },
    {
      "id": "local_validation",
      "state": "local_validation",
      "required": true,
      "evidence_kinds": [
        "command"
      ],
      "comparison": "release"
    },
    {
      "id": "git_push",
      "state": "pushed",
      "required": true,
      "evidence_kinds": [
        "git"
      ],
      "comparison": "branch",
      "comparison_reason": "A push claim describes this branch's HEAD, not the tagged release commit."
    },
    {
      "id": "ci",
      "state": "ci_verification",
      "required": true,
      "evidence_kinds": [
        "ci"
      ],
      "comparison": "release"
    },
    {
      "id": "github_release",
      "state": "github_release",
      "required": true,
      "evidence_kinds": [
        "github_release"
      ],
      "comparison": "release"
    },
    {
      "id": "npm_publication",
      "state": "external_publication",
      "required": true,
      "evidence_kinds": [
        "external"
      ],
      "comparison": "release"
    }
  ],
  "evidence": {
    "store": {
      "path": "logics/release/evidence.jsonl",
      "format": "jsonl",
      "required": true
    },
    "freshness": {
      "match_target_version": true,
      "match_commit_for_source_gates": true,
      "match_tag_for_publication_gates": true
    },
    "required_fields": [
      "kind",
      "status",
      "observed_at",
      "target_version",
      "commit",
      "tag",
      "summary"
    ]
  },
  "validation_commands": [
    {
      "id": "lint",
      "command": [
        "npm",
        "run",
        "lint"
      ],
      "required": true,
      "evidence_kind": "command"
    },
    {
      "id": "test",
      "command": [
        "npm",
        "test"
      ],
      "required": true,
      "evidence_kind": "command"
    },
    {
      "id": "build",
      "command": [
        "npm",
        "run",
        "build"
      ],
      "required": true,
      "evidence_kind": "command"
    }
  ],
  "git": {
    "release_branch_policy": "main_only",
    "allowed_branches": [
      "main"
    ],
    "tag_policy": {
      "required": true,
      "pattern": "v{version}"
    },
    "require_clean_worktree": true,
    "require_pushed_commit": true
  },
  "github_release": {
    "required": true,
    "mode": "gh_cli",
    "draft_allowed": false,
    "asset_paths": []
  },
  "external_publication": [
    {
      "id": "npm_package",
      "kind": "package_registry",
      "required": true,
      "url_template": "https://www.npmjs.com/package/cdx-manager/v/{version}"
    }
  ],
  "assistant_readiness": {
    "must_inspect_status_before_claiming_ready": true,
    "readiness_source": "project_owned_evidence",
    "publication_requires_explicit_operator_approval": true
  }
}
